No.,Chinese Name,Japanese Name,English Name,Description (Simplified),Description (Traditional),Common,Hidden
300,心眼,しんがん,Mind's Eye,一般属性和格斗属性的招式可以击中幽灵属性的宝可梦。无视对手的闪避率的变化，且命中率不会被降低。,一般屬性和格鬥屬性的招式可擊中幽靈屬性的寶可夢。可無視對手閃避率的變化，且命中率不會被降低。,1,0
301,面影辉映,おもかげやどし,Embody Aspect,将回忆映于心中，让碧草面具发出光辉，提高自己的速度。,將回憶映於心中，使碧草面具發出光輝，提高自己的速度。,1,0
302,面影辉映,おもかげやどし,Embody Aspect,将回忆映于心中，让火灶面具发出光辉，提高自己的攻击。,將回憶映於心中，使火灶面具發出光輝，提高自己的攻擊。,1,0
303,面影辉映,おもかげやどし,Embody Aspect,将回忆映于心中，让水井面具发出光辉，提高自己的特防。,將回憶映於心中，使水井面具發出光輝，提高自己的特防。,1,0
304,面影辉映,おもかげやどし,Embody Aspect,将回忆映于心中，让础石面具发出光辉，提高自己的防御。,將回憶映於心中，使礎石面具發出光輝，提高自己的防禦。,1,0
305,毒锁链,どくのくさり,Toxic Chain,凭借含有毒素的锁链的力量，有时能让被招式击中的对手陷入剧毒状态。,靠著含有毒素的鎖鏈的力量，有時會讓被招式擊中的對手陷入劇毒狀態。,3,0
306,甘露之蜜,かんろなミツ,Supersweet Syrup,首次出场时，会散发出甜腻的蜜的香味来降低对手的闪避率。,在對戰中首次出場時，會四處散播甜膩的蜜香，降低對手的閃避率。,2,0
308,太晶变形,テラスチェンジ,Tera Shift,出场时，会吸收周围的能量，变为太晶形态。,出場時，會吸收周圍的能量，變為太晶形態。,1,0
309,太晶甲壳,テラスシェル,Tera Shell,甲壳蕴藏着全部属性的力量，会将自己ＨＰ全满时受到的伤害全都变为效果不好。,蘊藏著所有屬性力量的甲殼會將自身ＨＰ全滿時受到的傷害全都變為效果不好。,1,0
310,归零化境,ゼロフォーミング,Teraform Zero,太乐巴戈斯变为星晶形态时，蕴藏在它身上的力量会将天气和场地的影响全部归零。,太樂巴戈斯變為星晶形態時，蘊藏其身的力量會將天氣和場地的影響全部歸零。,1,0
311,毒傀儡,どくくぐつ,Poison Puppeteer,因桃歹郎的招式而陷入中毒状态的对手同时也会陷入混乱状态。,因為桃歹郎的招式而陷入中毒狀態的對手同時也會陷入混亂狀態。,1,0
